{
  "$schema": "https://json-schema.org/draft/2020-12/schema",
  "$id": "https://github.com/wendell-britt/Six-faces-council/blob/main/schema/board-save.schema.json",
  "title": "Board save",
  "description": "One write from the board page to bars-engine (POST /api/board/saves). The same contract is checked by tests/test_save_contract.py here and src/lib/__tests__/board-save-contract.test.ts in bars-engine, against the fixtures in tests/fixtures/board-saves. A rows document is a council row a session posts through POST /api/board/session-writes (docs/worklist-api.md): one row of a rows file, its id the docId, its board list named in `kind` (a look's own `list` is its strand, as on a step), always a whole document. A save with mode set carries the whole document; mode update carries a patch that bars-engine merges onto the latest document, so the per-collection rules apply to set only. A stores document is one placement in the Stores' move (bars-engine /board/studio?stores=1): a run's thing put on the shelf, in the seed basket, up the bell line or in the compost ring, or taken by the tide; board/pull.py records it with the steps.",
  "type": "object",
  "additionalProperties": false,
  "required": ["board", "collection", "docId", "data"],
  "properties": {
    "board": {"enum": ["nonprofit", "council"]},
    "collection": {"enum": ["positions", "questions", "terms", "causes", "steer", "steps", "blockers", "picks",
                            "morning", "ttv", "lists", "contacts", "shows", "pickup", "seeds", "rows", "stores", "draws"]},
    "docId": {"type": "string", "minLength": 1, "maxLength": 200, "pattern": "^[^/\\\\\\u0000-\\u001f]+$"},
    "mode": {"enum": ["set", "update"], "default": "set"},
    "data": {"type": "object", "maxProperties": 200}
  },
  "$defs": {
    "text": {"type": "string", "pattern": "\\S"},
    "faces": {"type": "array", "minItems": 1, "items": {"type": "string"}},
    "row": {
      "properties": {"board": {"const": "council"}, "mode": {"const": "set"}, "data": {
        "required": ["kind", "pass"], "not": {"required": ["id"]},
        "properties": {"kind": {"enum": ["positions", "questions", "terms", "causes", "battles"]},
                       "pass": {"$ref": "#/$defs/text"}, "lane": {"type": "string"}},
        "allOf": [
          {"if": {"properties": {"kind": {"const": "positions"}}},
           "then": {"required": ["faces", "pos"], "properties": {"faces": {"$ref": "#/$defs/faces"}, "pos": {"$ref": "#/$defs/text"}}}},
          {"if": {"properties": {"kind": {"const": "questions"}}},
           "then": {"required": ["faces", "q", "options"], "properties": {"faces": {"$ref": "#/$defs/faces"},
             "q": {"$ref": "#/$defs/text"}, "options": {"type": "array", "minItems": 1, "items": {"type": "object",
               "required": ["v", "label"], "properties": {"v": {"$ref": "#/$defs/text"}, "label": {"type": "string"}}}}}}},
          {"if": {"properties": {"kind": {"const": "terms"}}},
           "then": {"required": ["term", "plain"], "properties": {"term": {"$ref": "#/$defs/text"}, "plain": {"type": "string"}}}},
          {"if": {"properties": {"kind": {"const": "causes"}}},
           "then": {"required": ["desc"], "properties": {"desc": {"$ref": "#/$defs/text"}}}},
          {"if": {"properties": {"kind": {"const": "battles"}}},
           "then": {"required": ["name", "rounds"], "properties": {"name": {"$ref": "#/$defs/text"}, "rounds": {"type": "array"}}}}
        ]}}
    },
    "iso": {"type": "string", "pattern": "^\\d{4}-\\d{2}-\\d{2}T\\d{2}:\\d{2}:\\d{2}(\\.\\d+)?Z$"},
    "decided": {
      "anyOf": [
        {"required": ["deferred"], "properties": {"deferred": {"const": true}}},
        {"required": ["steer"], "properties": {"steer": {"type": "string", "minLength": 1, "pattern": "\\S"}}}
      ]
    }
  },
  "allOf": [
    {"if": {"properties": {"collection": {"const": "rows"}}, "required": ["collection"]}, "then": {"$ref": "#/$defs/row"}},
    {"if": {"properties": {"mode": {"const": "update"}}, "required": ["mode"]}, "then": {}, "else": {"allOf": [
      {"if": {"properties": {"collection": {"enum": ["positions", "questions", "terms", "causes", "picks", "blockers"]}}},
       "then": {"properties": {"data": {"required": ["savedAt"], "properties": {"savedAt": {"$ref": "#/$defs/iso"}}}}}},
      {"if": {"properties": {"collection": {"const": "positions"}}},
       "then": {"properties": {"data": {"anyOf": [
         {"required": ["status"], "properties": {"status": {"enum": ["stands", "overrule", "retire"]}}},
         {"$ref": "#/$defs/decided"}]}}}},
      {"if": {"properties": {"collection": {"const": "questions"}}},
       "then": {"properties": {"data": {"anyOf": [
         {"required": ["choice"], "properties": {"choice": {"type": "string", "minLength": 1}}},
         {"required": ["choices"], "properties": {"choices": {"type": "array", "minItems": 1, "items": {"type": "string"}}}},
         {"$ref": "#/$defs/decided"}]}}}},
      {"if": {"properties": {"collection": {"const": "picks"}}},
       "then": {"properties": {"data": {"required": ["text", "date"], "properties": {
         "text": {"type": "string", "minLength": 1}, "date": {"type": "string", "pattern": "^\\d{4}-\\d{2}-\\d{2}$"}}}}}},
      {"if": {"properties": {"collection": {"const": "steer"}}},
       "then": {"properties": {"docId": {"const": "general"}, "data": {"required": ["text", "savedAt"],
         "properties": {"text": {"type": "string"}, "savedAt": {"$ref": "#/$defs/iso"}}}}}},
      {"if": {"properties": {"collection": {"const": "seeds"}}},
       "then": {"properties": {"board": {"const": "council"}, "data": {"required": ["taskId", "savedAt"], "properties": {
         "taskId": {"type": "string", "minLength": 1, "pattern": "\\S"}, "savedAt": {"$ref": "#/$defs/iso"}}}}}},
      {"if": {"properties": {"collection": {"const": "stores"}}},
       "then": {"properties": {"board": {"const": "council"}, "data": {"required": ["run", "thing", "kind", "words", "to", "savedAt"],
         "properties": {"run": {"$ref": "#/$defs/text"}, "thing": {"$ref": "#/$defs/text"}, "words": {"$ref": "#/$defs/text"},
           "kind": {"enum": ["jar", "seed", "thread", "husk"]}, "to": {"enum": ["shelf", "seeds", "bell", "compost", "tide"]},
           "savedAt": {"$ref": "#/$defs/iso"}}}}}},
      {"if": {"properties": {"collection": {"const": "draws"}}},
       "then": {"properties": {"board": {"const": "council"}, "data": {"required": ["deck", "card", "at"], "properties": {
         "deck": {"$ref": "#/$defs/text"}, "card": {"$ref": "#/$defs/text"}, "at": {"$ref": "#/$defs/iso"}}}}}},
      {"if": {"properties": {"collection": {"const": "morning"}, "docId": {"const": "menu"}}, "required": ["docId"]},
       "then": {"properties": {"data": {"required": ["menu", "savedAt"], "properties": {
         "menu": {"type": "string", "not": {"pattern": "\"rawEntry\""}}, "savedAt": {"$ref": "#/$defs/iso"}}}}}}
    ]}}
  ]
}
