{"board":"council","collection":"rows","docId":"wl-probe-look-1","data":{"list":"questions","pass":"worklist-api-slice-a","faces":["sage"],"q":"Does the probe row show?","why_you":"Only you can see the board.","look":true,"lookTitle":"Probe row","href":"https://bars-engine.vercel.app/board/council","supersedes":[],"options":[{"v":"A","label":"Yes","c":"It shows."},{"v":"B","label":"No","c":"It does not."}]}}
