{"board":"council","collection":"stores","docId":"run-2026-10-30~2026-10-30-pull-225123#questions.stores-move-look-1","mode":"set","data":{"run":"run-2026-10-30","thing":"2026-10-30-pull-225123#questions/stores-move-look-1","kind":"thread","words":"Yes, build it into bars-engine","to":"bell","savedAt":"2026-10-31T02:10:00.000Z"}}
